{
  "$schema": "https://json-schema.org/draft/2020-12/schema",
  "$id": "https://snow.miron.asia/schema/history.schema.json",
  "$defs": {
    "HistoryPoint": {
      "additionalProperties": false,
      "description": "Key numbers of one run; the full report is in the archive snapshot.",
      "properties": {
        "time": {
          "format": "date-time",
          "title": "Time",
          "type": "string"
        },
        "status": {
          "anyOf": [
            {
              "enum": [
                "open",
                "closed",
                "no_report"
              ],
              "type": "string"
            },
            {
              "type": "null"
            }
          ],
          "default": null,
          "title": "Status"
        },
        "mountain_cm": {
          "anyOf": [
            {
              "minimum": 0,
              "type": "integer"
            },
            {
              "type": "null"
            }
          ],
          "default": null,
          "title": "Mountain Cm"
        },
        "valley_cm": {
          "anyOf": [
            {
              "minimum": 0,
              "type": "integer"
            },
            {
              "type": "null"
            }
          ],
          "default": null,
          "title": "Valley Cm"
        },
        "fresh_cm": {
          "anyOf": [
            {
              "minimum": 0,
              "type": "integer"
            },
            {
              "type": "null"
            }
          ],
          "default": null,
          "title": "Fresh Cm"
        },
        "lifts_open": {
          "anyOf": [
            {
              "minimum": 0,
              "type": "integer"
            },
            {
              "type": "null"
            }
          ],
          "default": null,
          "title": "Lifts Open"
        },
        "lifts_total": {
          "anyOf": [
            {
              "minimum": 0,
              "type": "integer"
            },
            {
              "type": "null"
            }
          ],
          "default": null,
          "title": "Lifts Total"
        },
        "slopes_open": {
          "anyOf": [
            {
              "minimum": 0,
              "type": "integer"
            },
            {
              "type": "null"
            }
          ],
          "default": null,
          "title": "Slopes Open"
        },
        "slopes_total": {
          "anyOf": [
            {
              "minimum": 0,
              "type": "integer"
            },
            {
              "type": "null"
            }
          ],
          "default": null,
          "title": "Slopes Total"
        },
        "open_km": {
          "anyOf": [
            {
              "minimum": 0,
              "type": "number"
            },
            {
              "type": "null"
            }
          ],
          "default": null,
          "title": "Open Km"
        },
        "total_km": {
          "anyOf": [
            {
              "minimum": 0,
              "type": "integer"
            },
            {
              "type": "null"
            }
          ],
          "default": null,
          "title": "Total Km"
        },
        "avalanche_level": {
          "anyOf": [
            {
              "maximum": 5,
              "minimum": 1,
              "type": "integer"
            },
            {
              "type": "null"
            }
          ],
          "default": null,
          "title": "Avalanche Level"
        },
        "errors": {
          "default": 0,
          "minimum": 0,
          "title": "Errors",
          "type": "integer"
        },
        "snapshot": {
          "pattern": "^\\d{4}-\\d{2}-\\d{2}T\\d{2}-\\d{2}Z\\.json$",
          "title": "Snapshot",
          "type": "string"
        }
      },
      "required": [
        "time",
        "snapshot"
      ],
      "title": "HistoryPoint",
      "type": "object"
    }
  },
  "additionalProperties": false,
  "description": "Every run for one resort, oldest first.",
  "properties": {
    "$schema": {
      "const": "https://snow.miron.asia/schema/history.schema.json",
      "default": "https://snow.miron.asia/schema/history.schema.json",
      "title": "$Schema",
      "type": "string"
    },
    "id": {
      "pattern": "^[a-z0-9-]+$",
      "title": "Id",
      "type": "string"
    },
    "country": {
      "pattern": "^[a-z]{2}$",
      "title": "Country",
      "type": "string"
    },
    "name": {
      "minLength": 1,
      "title": "Name",
      "type": "string"
    },
    "points": {
      "items": {
        "$ref": "#/$defs/HistoryPoint"
      },
      "title": "Points",
      "type": "array"
    }
  },
  "required": [
    "id",
    "country",
    "name"
  ],
  "title": "Snow conditions history for one resort",
  "type": "object"
}
