{
  "$schema": "https://snow.miron.asia/schema/history.schema.json",
  "id": "russbach-dachstein-west",
  "country": "at",
  "name": "Russbach - Dachstein West",
  "points": [
    {
      "time": "2026-10-25T08:38:04+01:00",
      "status": "closed",
      "mountain_cm": null,
      "valley_cm": null,
      "fresh_cm": null,
      "lifts_open": 0,
      "lifts_total": 22,
      "slopes_open": null,
      "slopes_total": null,
      "open_km": 0.0,
      "total_km": 14,
      "avalanche_level": null,
      "errors": 0,
      "snapshot": "2026-10-25T07-38Z.json"
    },
    {
      "time": "2026-10-25T10:00:56+01:00",
      "status": "closed",
      "mountain_cm": null,
      "valley_cm": null,
      "fresh_cm": null,
      "lifts_open": 0,
      "lifts_total": 22,
      "slopes_open": null,
      "slopes_total": null,
      "open_km": 0.0,
      "total_km": 14,
      "avalanche_level": null,
      "errors": 0,
      "snapshot": "2026-10-25T09-00Z.json"
    }
  ]
}
