{
  "$schema": "https://snow.miron.asia/schema/history.schema.json",
  "id": "zahmer-kaiser-walchsee",
  "country": "at",
  "name": "Zahmer Kaiser - Walchsee",
  "points": [
    {
      "time": "2026-10-24T22:37:56+02:00",
      "status": "no_report",
      "mountain_cm": null,
      "valley_cm": null,
      "fresh_cm": null,
      "lifts_open": null,
      "lifts_total": null,
      "slopes_open": null,
      "slopes_total": null,
      "open_km": null,
      "total_km": null,
      "avalanche_level": null,
      "errors": 0,
      "snapshot": "2026-10-24T20-37Z.json"
    },
    {
      "time": "2026-10-25T08:38:04+01:00",
      "status": "no_report",
      "mountain_cm": null,
      "valley_cm": null,
      "fresh_cm": null,
      "lifts_open": null,
      "lifts_total": null,
      "slopes_open": null,
      "slopes_total": null,
      "open_km": null,
      "total_km": null,
      "avalanche_level": null,
      "errors": 0,
      "snapshot": "2026-10-24T20-37Z.json"
    },
    {
      "time": "2026-10-25T10:00:56+01:00",
      "status": "no_report",
      "mountain_cm": null,
      "valley_cm": null,
      "fresh_cm": null,
      "lifts_open": null,
      "lifts_total": null,
      "slopes_open": null,
      "slopes_total": null,
      "open_km": null,
      "total_km": null,
      "avalanche_level": null,
      "errors": 0,
      "snapshot": "2026-10-25T09-00Z.json"
    }
  ]
}
